{
  "_format": "re_engine_motlist_action_tracks_v1",
  "sourcePath": "STM/GameDesign/Event/evc/evc0015/evc0015_50/chara/em0151_00_0_01/evc0015_50_em0151_00_0_01.motlist.992",
  "motlistName": "evc0015_50_em0151_00_0_01",
  "motlistVersion": 992,
  "motlistVersionName": "MHWILDS",
  "trackFilters": [
    "property:_RequestSetID"
  ],
  "statistics": {
    "totalMotions": 12,
    "matchedMotions": 0,
    "inspectedClips": 0,
    "matchedClips": 0,
    "matchedTracks": 0,
    "requestSetMappings": 0
  },
  "requestSetMappings": [],
  "motions": []
}
