{
  "_format": "re_engine_motlist_action_tracks_v1",
  "sourcePath": "STM/Motion/NPC/Airou/Lobby/npc_PinCheck_Airou_Lobby/npc_PinCheck_Airou_Lobby.motlist.992",
  "motlistName": "npc_PinCheck_Airou_Lobby",
  "motlistVersion": 992,
  "motlistVersionName": "MHWILDS",
  "trackFilters": [
    "property:_RequestSetID"
  ],
  "statistics": {
    "totalMotions": 13,
    "matchedMotions": 0,
    "inspectedClips": 13,
    "matchedClips": 0,
    "matchedTracks": 0,
    "requestSetMappings": 0
  },
  "requestSetMappings": [],
  "motions": []
}
