{
  "_format": "re_engine_motlist_action_tracks_v1",
  "sourcePath": "STM/GameDesign/Event/egm/egm0002/egm0002_50/chara/npc102_00_010_00/egm0002_50_npc102_00_010_00.motlist.992",
  "motlistName": "egm0002_50_npc102_00_010_00",
  "motlistVersion": 992,
  "motlistVersionName": "MHWILDS",
  "trackFilters": [
    "property:_RequestSetID"
  ],
  "statistics": {
    "totalMotions": 1,
    "matchedMotions": 0,
    "inspectedClips": 0,
    "matchedClips": 0,
    "matchedTracks": 0,
    "requestSetMappings": 0
  },
  "requestSetMappings": [],
  "motions": []
}
