{
  "_format": "re_engine_motlist_action_tracks_v1",
  "sourcePath": "STM/GameDesign/Event/evc/evc2040/evc2040_65/chara/NPC310_01_903/face/evc2040_65_NPC310_01_903_face.motlist.992",
  "motlistName": "evc2040_65_NPC310_01_903_face",
  "motlistVersion": 992,
  "motlistVersionName": "MHWILDS",
  "trackFilters": [
    "property:_RequestSetID"
  ],
  "statistics": {
    "totalMotions": 2,
    "matchedMotions": 0,
    "inspectedClips": 0,
    "matchedClips": 0,
    "matchedTracks": 0,
    "requestSetMappings": 0
  },
  "requestSetMappings": [],
  "motions": []
}
