{
  "_format": "re_engine_motlist_action_tracks_v1",
  "sourcePath": "STM/GameDesign/Event/evc/evc0036/evc0036_50/chara/npc111_15_007_00/face/evc0036_50_npc111_15_007_00_face.motlist.992",
  "motlistName": "evc0036_50_npc111_15_007_00_face",
  "motlistVersion": 992,
  "motlistVersionName": "MHWILDS",
  "trackFilters": [
    "property:_RequestSetID"
  ],
  "statistics": {
    "totalMotions": 3,
    "matchedMotions": 0,
    "inspectedClips": 0,
    "matchedClips": 0,
    "matchedTracks": 0,
    "requestSetMappings": 0
  },
  "requestSetMappings": [],
  "motions": []
}
