{
  "_format": "re_engine_motlist_action_tracks_v1",
  "sourcePath": "STM/GameDesign/Event/evc/evc0005/evc0005_51/chara/npc111_21_039_00/evc0005_51_npc111_21_039_00.motlist.992",
  "motlistName": "evc0005_51_npc111_21_039_00",
  "motlistVersion": 992,
  "motlistVersionName": "MHWILDS",
  "trackFilters": [
    "property:_RequestSetID"
  ],
  "statistics": {
    "totalMotions": 10,
    "matchedMotions": 0,
    "inspectedClips": 0,
    "matchedClips": 0,
    "matchedTracks": 0,
    "requestSetMappings": 0
  },
  "requestSetMappings": [],
  "motions": []
}
