{
  "_format": "re_engine_motlist_action_tracks_v1",
  "sourcePath": "STM/Motion/Player/Weapon/Wp13/wp13_tree/wp13_tree.motlist.992",
  "motlistName": "wp13_tree",
  "motlistVersion": 992,
  "motlistVersionName": "MHWILDS",
  "trackFilters": [
    "property:_RequestSetID"
  ],
  "statistics": {
    "totalMotions": 16,
    "matchedMotions": 0,
    "inspectedClips": 0,
    "matchedClips": 0,
    "matchedTracks": 0,
    "requestSetMappings": 0
  },
  "requestSetMappings": [],
  "motions": []
}
