{
  "_format": "re_engine_motlist_action_tracks_v1",
  "sourcePath": "STM/Motion/NPC/Child/npc_Sweeping_Child/npc_Sweeping_Child.motlist.992",
  "motlistName": "npc_Sweeping_Child",
  "motlistVersion": 992,
  "motlistVersionName": "MHWILDS",
  "trackFilters": [
    "property:_RequestSetID"
  ],
  "statistics": {
    "totalMotions": 3,
    "matchedMotions": 0,
    "inspectedClips": 2,
    "matchedClips": 0,
    "matchedTracks": 0,
    "requestSetMappings": 0
  },
  "requestSetMappings": [],
  "motions": []
}
